codigo;nombre;id_padre;sigla;usuario_crea;fecha_crea
1;Presidencia del Consejo de Ministros;10;PCM;1;01-08-2025
2;Instituto Nacional de Estadística e Informática;10;INEI;1;01-08-2025
10;Dirección Nacional de Inteligencia;10;DINI;1;01-08-2025
11;Despacho Presidencial;10;DP;1;01-08-2025
12;Comisión Nacional para el Desarrollo y Vida sin Drogas;10;DEVIDA;1;01-08-2025
16;Centro Nacional de Planeamiento Estratégico;10;CEPLAN;1;01-08-2025
19;Organismo Supervisor de la Inversión Privada en Telecomunicaciones;10;OSIPTEL;1;01-08-2025
20;Organismo Supervisor de la Inversión en Energía y Minería;10;OSINERGMIN;1;01-08-2025
21;Superintendencia Nacional de Servicios de Saneamiento;10;SUNASS;1;01-08-2025
22;Organismo Supervisor de la Inversión en Infraestructura de Transporte de Uso Público;10;OSITRAN;1;01-08-2025
23;Autoridad Nacional del Servicio Civil;10;SERVIR;1;01-08-2025
24;Organismo de Supervisión de los Recursos Forestales y de Fauna Silvestre;10;OSINFOR;1;01-08-2025
29;Autoridad Nacional de Infraestructura;10;ANIN;1;01-08-2025
31;Organismo de Estudios y Diseño de Proyectos de Inversión;10;OEDI;1;01-08-2025
114;Consejo Nacional de Ciencia, Tecnología e Innovación Tecnológica;10;CONCYTEC;1;01-08-2025
183;Instituto Nacional de Defensa de la Competencia y de la Protección de la Propiedad Intelectual;10;INDECOPI;1;01-08-2025
;Proyecto Especial Legado;10;LEGADO;1;01-08-2025
3;Ministerio de Cultura;11;MC;1;01-08-2025
60;Archivo General de la Nación;11;CULTURA;1;01-08-2025
113;Biblioteca Nacional del Peru;11;BNP;1;01-08-2025
116;Instituto Nacional de Radio y Televisión del Perú;11;IRTP;1;01-08-2025
4;Poder Judicial;12;PJ;1;01-08-2025
40;Academia de la Magistratura;13;AMAG;1;01-08-2025
5;Ministerio del Ambiente;13;MINAM;1;01-08-2025
50;Servicio Nacional de Áreas Naturales Protegidas por el Estado;13;SERNANP;1;01-08-2025
51;Organismo de Evaluación y Fiscalización Ambiental;13;OEFA;1;01-08-2025
52;Servicio Nacional de Certificación Ambiental para las Inversiones Sostenibles;13;SENACE;1;01-08-2025
55;Instituto de Investigaciones de la Amazonia Peruana;13;IIAP;1;01-08-2025
56;Instituto Nacional de Investigación en Glaciares y Ecosistemas de Montaña;13;INAIGEM;1;01-08-2025
112;Instituto Geofísico del Peru;13;IGP;1;01-08-2025
331;Servicio Nacional de Meteorología e Hidrología;13;SENAMHI;1;01-08-2025
6;Ministerio de Justicia y Derechos Humanos;14;MINJUS;1;01-08-2025
61;Instituto Nacional Penitenciario;14;INP;1;01-08-2025
67;Superintendencia Nacional de los Registros Públicos;14;SUNARP;1;01-08-2025
68;Procuraduría General del Estado;14;PGE;1;01-08-2025
;Programa Nacional de Centros Juveniles;14;PRONACEJ;1;01-08-2025
7;Ministerio del Interior;15;MININTER;1;01-08-2025
70;Intendencia Nacional de Bomberos del Perú;15;INBP;1;01-08-2025
72;Superintendencia Nacional de Control de Servicios de Seguridad, Armas, Municiones y Explosivos de Uso Civil;15;SUCAMEC;1;01-08-2025
73;Superintendencia Nacional de Migraciones;15;MIGRACIONES;1;01-08-2025
8;Ministerio de Relaciones Exteriores;16;RR.EE.;1;01-08-2025
80;Agencia Peruana de Cooperación Internacional;16;APCI;1;01-08-2025
;Plan Binacional de Desarrollo de la Región Fronteriza Perú - Ecuador;16;BINACIONAL;1;01-08-2025
9;Ministerio de Economía y Finanzas;17;MEF;1;01-08-2025
55;Agencia de Promoción de la Inversión Privada;17;PROINVERSION;1;01-08-2025
57;Superintendencia Nacional de Aduanas y de Administración Tributaria;17;SUNAT;1;01-08-2025
58;Superintendencia del Mercado de Valores;17;SMV;1;01-08-2025
59;Organismo Especializado para las Contrataciones Publicas Eficientes;17;OECE;1;01-08-2025
95;Oficina de Normalización Previsional;17;ONP;1;01-08-2025
96;Central de Compras Públicas;17;PERU COMPRAS;1;01-08-2025
;Banco de la Nación;17;BN;1;01-08-2025
;Superintendencia de Banca, Seguros y Administradoras Privadas de Fondos de Pensiones;17;SBS;1;01-08-2025
10;Ministerio de Educación;18;MINEDU;1;01-08-2025
111;Centro Vacacional Huampani;18;HUAMPANI;1;01-08-2025
117;Sistema Nacional de Evaluación, Acreditación y Certificación de la Calidad Educativa;18;SINEACE;1;01-08-2025
118;Superintendencia Nacional de Educación Superior Universitaria;18;SUNEDU;1;01-08-2025
342;Instituto Peruano del Deporte;18;IPD;1;01-08-2025
;Proyecto Especial de Inversión Pública Escuelas Bicentenario;18;ESCUELAS BICENTENARIO;1;01-08-2025
510;Universidad Nacional Mayor de San Marcos;18;UNMSM;1;01-08-2025
511;Universidad Nacional de San Antonio Abad del Cusco;18;UNSAAC;1;01-08-2025
512;Universidad Nacional de Trujillo;18;UNT;1;01-08-2025
513;Universidad Nacional de San Agustin;18;UNSA;1;01-08-2025
514;Universidad Nacional de Ingeniería;18;UNI;1;01-08-2025
515;Universidad Nacional San Luis Gonzaga de Ica;18;UNSLG;1;01-08-2025
516;Universidad Nacional San Cristóbal de Huamanga;18;UNSCH;1;01-08-2025
517;Universidad Nacional del Centro del Perú;18;UNCP;1;01-08-2025
518;Universidad Nacional Agraria la Molina;18;UNALM;1;01-08-2025
519;Universidad Nacional de la Amazonia Peruana;18;UNAP;1;01-08-2025
520;Universidad Nacional del Altiplano;18;UNA PUNO;1;01-08-2025
521;Universidad Nacional de Piura;18;UNP;1;01-08-2025
522;Universidad Nacional de Cajamarca;18;UNC;1;01-08-2025
523;Universidad Nacional Pedro Ruiz Gallo;18;UNPRG;1;01-08-2025
524;Universidad Nacional Federico Villarreal;18;UNFV;1;01-08-2025
525;Universidad Nacional Hermilio Valdizan;18;UNHV;1;01-08-2025
526;Universidad Nacional Agraria de la Selva;18;UNAS;1;01-08-2025
527;Universidad Nacional Daniel Alcides Carrion;18;UNDAC;1;01-08-2025
528;Universidad Nacional de Educación Enrique Guzmán y Valle;18;UNE;1;01-08-2025
529;Universidad Nacional del Callao;18;UNAC;1;01-08-2025
530;Universidad Nacional José Faustino Sánchez Carrion;18;UNJFSC;1;01-08-2025
531;Universidad Nacional Jorge Basadre Grohmann;18;UNJBG;1;01-08-2025
532;Universidad Nacional Santiago Antúnez de Mayolo;18;UNSAM;1;01-08-2025
533;Universidad Nacional de San Martin;18;UNSM;1;01-08-2025
534;Universidad Nacional de Ucayali;18;UNU;1;01-08-2025
535;Universidad Nacional de Tumbes;18;UNT;1;01-08-2025
536;Universidad Nacional del Santa;18;UNS;1;01-08-2025
537;Universidad Nacional de Huancavelica;18;UNH;1;01-08-2025
538;Universidad Nacional Amazónica de Madre de Dios;18;UNAMAD;1;01-08-2025
539;Universidad Nacional Micaela Bastidas de Apurímac;18;UNAMBA;1;01-08-2025
541;Universidad Nacional Toribio Rodríguez de Mendoza de Amazonas;18;UNTRM;1;01-08-2025
542;Universidad Nacional Intercultural de la Amazonia;18;UNIA;1;01-08-2025
543;Universidad Nacional Tecnológica de Lima Sur;18;UNTELS;1;01-08-2025
544;Universidad Nacional José María Arguedas;18;UNAJMA;1;01-08-2025
545;Universidad Nacional de Moquegua;18;UNM;1;01-08-2025
546;Universidad Nacional de Jaen;18;UNJ;1;01-08-2025
547;Universidad Nacional de Cañete;18;UNDC;1;01-08-2025
548;Universidad Nacional de Frontera;18;UNF;1;01-08-2025
549;Universidad Nacional de Barranca;18;UNAB;1;01-08-2025
550;Universidad Nacional Autónoma de Chota;18;UNACH;1;01-08-2025
551;Universidad Nacional Intercultural de la Selva Central Juan Santos Atahualpa;18;UNISCJSA;1;01-08-2025
552;Universidad Nacional de Juliaca;18;UNAJ;1;01-08-2025
553;Universidad Nacional Autónoma Altoandina de Tarma;18;UNAAT;1;01-08-2025
554;Universidad Nacional Autónoma de Huanta;18;UNAH;1;01-08-2025
555;Universidad Nacional Intercultural Fabiola Salazar Leguía de Bagua;18;UNIFSLB;1;01-08-2025
556;Universidad Nacional Intercultural de Quillabamba;18;UNIQ;1;01-08-2025
557;Universidad Nacional Autónoma de Alto Amazonas;18;UNAAA;1;01-08-2025
558;Universidad Nacional Autónoma de Tayacaja Daniel Hernández Morillo;18;UNAT;1;01-08-2025
559;Universidad Nacional Ciro Alegria;18;UNCA;1;01-08-2025
560;Universidad Nacional de Arte Diego Quispe Tito del Cusco;18;UNADQTC;1;01-08-2025
561;Universidad Nacional de Música;18;UNM;1;01-08-2025
562;Universidad Nacional Daniel Alomia Robles;18;UNDAR;1;01-08-2025
563;Universidad Nacional Tecnológica de Frontera San Ignacio de Loyola;18;UNATEFSIL;1;01-08-2025
564;Universidad Nacional Tecnológica de San Juan de Lurigancho;18;UNTSJL;1;01-08-2025
567;Universidad Nacional del Vraem;18;;1;01-08-2025
569;Universidad Nacional Autónoma de Cutervo;18;;1;01-08-2025
11;Ministerio de Salud;19;MINSA;1;01-08-2025
131;Instituto Nacional de Salud;19;INS;1;01-08-2025
134;Superintendencia Nacional de Salud;19;SUSALUD;1;01-08-2025
135;Seguro Integral de Salud;19;SIS;1;01-08-2025
136;Instituto Nacional de Enfermedades Neoplasicas;19;INEN;1;01-08-2025
;Instituto Nacional de Rehabilitación;19;INR;1;01-08-2025
12;Ministerio de Trabajo y Promoción del Empleo;20;MTPE;1;01-08-2025
121;Superintendencia Nacional de Fiscalización Laboral;20;SUNAFIL;1;01-08-2025
;Programa de Empleo Temporal;20;LLAMKASUN PERÚ;1;01-08-2025
13;Ministerio de Desarrollo Agrario y Riego;21;MIDAGRI;1;01-08-2025
18;Agromercado;21;AGROMERCADO;1;01-08-2025
160;Servicio Nacional de Sanidad Agraria;21;SENASA;1;01-08-2025
163;Instituto Nacional de Innovación Agraria;21;INIA;1;01-08-2025
164;Autoridad Nacional del Agua;21;ANA;1;01-08-2025
165;Servicio Nacional Forestal y de Fauna Silvestre;21;SERFOR;1;01-08-2025
16;Ministerio de Energía y Minas;22;MINEM;1;01-08-2025
220;Instituto Peruano de Energía Nuclear;22;IPEN;1;01-08-2025
221;Instituto Geológico Minero y Metalurgico;22;INGEMMET;1;01-08-2025
;Empresa de Administración de Infraestructura Eléctrica S.A.;22;ADINELSA;1;01-08-2025
;Empresa de Servicio Público de Electricidad del Nor Oeste del Perú S.A.;22;ENOSA;1;01-08-2025
;Empresa de Servicio Público de Electricidad Electro Norte Medio S.A;22;HIDRANDINA;1;01-08-2025
;Grupo ISA;22;ISA REP;1;01-08-2025
19;Contraloría General de la República;23;CGR;1;01-08-2025
20;Defensoría del Pueblo;24;DEFENSORIA;1;01-08-2025
21;Junta Nacional de Justicia;25;JNJ;1;01-08-2025
22;Ministerio Público;26;MP;1;01-08-2025
24;Tribunal Constitucional;27;TC;1;01-08-2025
26;Ministerio de Defensa;28;MINDEF;1;01-08-2025
6;Instituto Nacional de Defensa Civil;28;INDECI;1;01-08-2025
25;Centro Nacional de Estimación, Prevención y Reducción del Riesgo de Desastres;28;CENEPRED;1;01-08-2025
332;Instituto Geográfico Nacional;28;IGN;1;01-08-2025
335;Agencia de Compras de las Fuerzas Armadas;28;ACFFAA;1;01-08-2025
002-469;Comando Conjunto de las Fuerzas Armadas;28;CCFFAA;1;01-08-2025
003-470;Ejército Peruano;28;EP;1;01-08-2025
004-471;Marina de Guerra del Perú;28;MGP;1;01-08-2025
005-472;Fuerza Aérea del Perú;28;FAP;1;01-08-2025
006-1122;Comision Nacional de Investigación y Desarrollo Aeroespacial;28;CONIDA;1;01-08-2025
008-1123;Escuela Nacional de Marina Mercante;28;ENAMM;1;01-08-2025
009-1124;Oficina Previsional de las Fuerzas Armadas;28;OPREFA;1;01-08-2025
011-1761;Centro de Altos Estudios Nacionales;28;CAEN-EPG;1;01-08-2025
;Caja de Pensiones Militar Policial;28;CPMP;1;01-08-2025
;Servicios Industriales de la Marina S.A.;28;SIMA;1;01-08-2025
27;Fuero Militar Policial;29;FMP;1;01-08-2025
28;Congreso de la Republica;30;CONGRESO;1;01-08-2025
31;Jurado Nacional de Elecciones;31;JNE;1;01-08-2025
32;Oficina Nacional de Procesos Electorales;32;ONPE;1;01-08-2025
33;Registro Nacional de Identificación y Estado Civil;33;RENIEC;1;01-08-2025
35;Ministerio de Comercio Exterior y Turismo;34;MINCETUR;1;01-08-2025
8;Comisión de Promoción del Perú para la Exportación y el Turismo;34;PROMPERU;1;01-08-2025
180;Centro de Formación en Turismo;34;CENFOTUR;1;01-08-2025
;Unidad Ejecutora de Inversión en Comercio Exterior y Turismo;24;COPESCO NACIONAL;1;01-08-2025
36;Ministerio de Transportes y Comunicaciones;35;MTC;1;01-08-2025
202;Superintendencia de Transporte Terrestre de Personas, Carga y Mercancias;35;SUTRAN;1;01-08-2025
203;Autoridad de Transporte Urbano para Lima y Callao;35;ATU;1;01-08-2025
214;Autoridad Portuaria Nacional;35;APN;1;01-08-2025
;Programa Nacional de Telecomunicaciones;35;PRONATEL;1;01-08-2025
37;Ministerio de Vivienda, Construcción y Saneamiento;36;MVCS;1;01-08-2025
56;Superintendencia Nacional de Bienes Estatales;36;SBN;1;01-08-2025
205;Servicio Nacional de Capacitación para la Industria de la Construcción;36;SENCICO;1;01-08-2025
207;Organismo Técnico de la Administración de los Servicios de Saneamiento;36;OTASS;1;01-08-2025
211;Organismo de Formalización de la Propiedad Informal;36;COFOPRI;1;01-08-2025
;Fondo Mivivienda S.A.;36;FMV;1;01-08-2025
;Servicio de Agua Potable y Alcantarillado de Lima;36;SEDAPAL;1;01-08-2025
;Programa Nacional de Saneamiento Rural;36;PNSR;1;01-08-2025
38;Ministerio de la Producción;37;PRODUCE;1;01-08-2025
59;Fondo Nacional de Desarrollo Pesquero;37;FONDEPES;1;01-08-2025
240;Instituto del Mar del Peru;37;IMARPE;1;01-08-2025
241;Instituto Tecnológico de la Producción;37;ITP;1;01-08-2025
243;Autoridad Nacional de Sanidad e Inocuidad en Pesca y Acuicultura;37;SANIPES;1;01-08-2025
244;Instituto Nacional de Calidad;37;INACAL;1;01-08-2025
;Programa Nacional A Comer Pescado;37;PNACP;1;01-08-2025
39;Ministerio de la Mujer y Poblaciones Vulnerables;38;MIMP;1;01-08-2025
345;Consejo Nacional para la Integración de la Persona con Discapacidad;38;CONADIS;1;01-08-2025
;Programa Integral Nacional para el Bienestar Familiar;38;INABIF;1;01-08-2025
40;Ministerio de Desarrollo e Inclusión Social;39;MIDIS;1;01-08-2025
41;Organismo de Focalización e Información Social;39;OFIS;1;01-08-2025
003-1426;Programa Nacional Cuna Mas;39;PNCM;1;01-08-2025
004-1427;Fondo de Cooperación para el Desarrollo Social;39;FONCODES;1;01-08-2025
005-1428;Programa Nacional de Apoyo Directo A los Mas Pobres;39;JUNTOS;1;01-08-2025
006-1441;Programa Nacional de Asistencia Solidaria;39;PENSION 65;1;01-08-2025
007-1456;Programa Nacional de Alimentación Escolar Comunitaria;39;WASI MIKUNA;1;01-08-2025
008-1674;Programa Nacional Plataformas de Acción para la Inclusión Social;39;PAIS;1;01-08-2025
010-1723;Programa Nacional de Entrega de la Pensión No Contributiva A Personas con Discapacidad Severa en Situación de Pobreza;39;CONTIGO;1;01-08-2025
440;Gobierno Regional del Departamento de Amazonas;40;GORE AMAZONAS;1;01-08-2025
441;Gobierno Regional del Departamento de Ancash;40;GORE ANCASH;1;01-08-2025
442;Gobierno Regional del Departamento de Apurímac;40;GORE APURIMAC;1;01-08-2025
443;Gobierno Regional del Departamento de Arequipa;40;GORE AREQUIPA;1;01-08-2025
444;Gobierno Regional del Departamento de Ayacucho;40;GORE AYACUCHO;1;01-08-2025
445;Gobierno Regional del Departamento de Cajamarca;40;GORE CAJAMARCA;1;01-08-2025
446;Gobierno Regional del Departamento de Cusco;40;GORE CUSCO;1;01-08-2025
447;Gobierno Regional del Departamento de Huancavelica;40;GORE HUANCAVELICA;1;01-08-2025
448;Gobierno Regional del Departamento de Huánuco;40;GORE HUANUCO;1;01-08-2025
449;Gobierno Regional del Departamento de Ica;40;GORE ICA;1;01-08-2025
450;Gobierno Regional del Departamento de Junin;40;GORE JUNIN;1;01-08-2025
451;Gobierno Regional del Departamento de la Libertad;40;GORE LIBERTAD;1;01-08-2025
452;Gobierno Regional del Departamento de Lambayeque;40;GORE LAMBAYEQUE;1;01-08-2025
453;Gobierno Regional del Departamento de Loreto;40;GORE LORETO;1;01-08-2025
454;Gobierno Regional del Departamento de Madre de Dios;40;GORE DIOS;1;01-08-2025
455;Gobierno Regional del Departamento de Moquegua;40;GORE MOQUEGUA;1;01-08-2025
456;Gobierno Regional del Departamento de Pasco;40;GORE PASCO;1;01-08-2025
457;Gobierno Regional del Departamento de Piura;40;GORE PIURA;1;01-08-2025
458;Gobierno Regional del Departamento de Puno;40;GORE PUNO;1;01-08-2025
459;Gobierno Regional del Departamento de San Martin;40;GORE MARTIN;1;01-08-2025
460;Gobierno Regional del Departamento de Tacna;40;GORE TACNA;1;01-08-2025
461;Gobierno Regional del Departamento de Tumbes;40;GORE TUMBES;1;01-08-2025
462;Gobierno Regional del Departamento de Ucayali;40;GORE UCAYALI;1;01-08-2025
463;Gobierno Regional del Departamento de Lima;40;GORE LIMA;1;01-08-2025
464;Gobierno Regional de la Provincia Constitucional del Callao;40;GORE CALLAO;1;01-08-2025
465;Municipalidad Metropolitana de Lima;41;MML;1;01-08-2025
;Instituto Catastral de Lima;41;ICL;1;01-08-2025
;Centro de Información y Educación para la Prevención del Abuso de Drogas;42;CEDRO;1;01-08-2025
;Sociedad Nacional de Minería, Petróleo y Energía;42;SNMPE;1;01-08-2025
;Fondo de Población de las Naciones Unidas;43;UNFPA;1;01-08-2025
;Programa de las Naciones Unidas para el Desarrollo;43;PNUD;1;01-08-2025
;Programa Mundial de Alimentos;43;PMA;1;01-08-2025
;Telefónica del Perú;44;TELEFONICA;1;01-08-2025
